{
  "schema_version": "ecosystem_registry_v1",
  "contract_status": "preview",
  "action_ids": ["configure", "build", "test", "lint", "typecheck"],
  "execution_policy": {
    "detection_mutates": false,
    "automatic_install": false,
    "descriptor_only_commands": true,
    "requires_authorization": true,
    "cwd_within_workspace": true,
    "max_timeout_seconds": 1200,
    "allowed_env": ["CI", "NO_COLOR", "PYTHONUTF8"]
  },
  "ecosystems": [
    {
      "id": "python",
      "label": "Python",
      "status": "preview",
      "categories": ["backend", "data", "automation"],
      "detectors": {
        "manifests": ["pyproject.toml", "requirements.txt", "setup.py", "pytest.ini", "tox.ini", "noxfile.py"],
        "extensions": [".py", ".pyi"]
      },
      "runtimes": [
        {"id": "python", "candidates": ["python3", "python"], "version_args": ["--version"]}
      ],
      "action_dependencies": [],
      "commands": {
        "configure": [],
        "build": [
          {
            "id": "python_build",
            "runtime_id": "python",
            "argv": ["{runtime}", "-m", "build"],
            "selectors": {"manifests": ["pyproject.toml"], "globs": [], "json_script": null, "content_markers": {}},
            "cwd": "manifest_dir",
            "env": {"PYTHONUTF8": "1"},
            "timeout_seconds": 600,
            "required_capability": "build_execute",
            "mutates_workspace": true,
            "project_script": false,
            "status": "planned"
          }
        ],
        "test": [
          {
            "id": "pytest",
            "runtime_id": "python",
            "argv": ["{runtime}", "-m", "pytest", "-q", "{test_targets}"],
            "selectors": {
              "manifests": ["pytest.ini", "tox.ini", "noxfile.py"],
              "globs": ["test_*.py", "tests/test_*.py", "tests/**/test_*.py", "test/test_*.py", "test/**/test_*.py"],
              "json_script": null,
              "content_markers": {"pyproject.toml": ["pytest"]}
            },
            "cwd": "workspace",
            "env": {"PYTHONUTF8": "1", "NO_COLOR": "1"},
            "timeout_seconds": 600,
            "required_capability": "test_execute",
            "mutates_workspace": false,
            "project_script": false,
            "status": "legacy_enabled"
          }
        ],
        "lint": [
          {
            "id": "ruff",
            "runtime_id": "python",
            "argv": ["{runtime}", "-m", "ruff", "check", "."],
            "selectors": {"manifests": [], "globs": [], "json_script": null, "content_markers": {"pyproject.toml": ["ruff"]}},
            "cwd": "workspace",
            "env": {"PYTHONUTF8": "1", "NO_COLOR": "1"},
            "timeout_seconds": 300,
            "required_capability": "test_execute",
            "mutates_workspace": false,
            "project_script": false,
            "status": "planned"
          }
        ],
        "typecheck": []
      },
      "artifacts": ["dist/*.whl", "dist/*.tar.gz", ".coverage", "htmlcov/**"]
    },
    {
      "id": "javascript_typescript",
      "label": "JavaScript / TypeScript",
      "status": "preview",
      "categories": ["frontend", "backend", "web"],
      "detectors": {
        "manifests": ["package.json", "package-lock.json", "pnpm-lock.yaml", "yarn.lock", "tsconfig.json"],
        "extensions": [".js", ".jsx", ".mjs", ".cjs", ".ts", ".tsx"]
      },
      "runtimes": [
        {"id": "node", "candidates": ["node"], "version_args": ["--version"]},
        {"id": "npm", "candidates": ["npm.cmd", "npm"], "version_args": ["--version"]}
      ],
      "action_dependencies": [],
      "commands": {
        "configure": [],
        "build": [
          {
            "id": "npm_build",
            "runtime_id": "npm",
            "argv": ["{runtime}", "run", "build"],
            "selectors": {"manifests": [], "globs": [], "json_script": "build", "content_markers": {}},
            "cwd": "manifest_dir",
            "env": {"CI": "1", "NO_COLOR": "1"},
            "timeout_seconds": 900,
            "required_capability": "build_execute",
            "mutates_workspace": true,
            "project_script": true,
            "status": "planned"
          }
        ],
        "test": [
          {
            "id": "npm_test",
            "runtime_id": "npm",
            "argv": ["{runtime}", "test", "--silent"],
            "selectors": {"manifests": [], "globs": [], "json_script": "test", "content_markers": {}},
            "cwd": "manifest_dir",
            "env": {"CI": "1", "NO_COLOR": "1"},
            "timeout_seconds": 600,
            "required_capability": "test_execute",
            "mutates_workspace": false,
            "project_script": true,
            "status": "legacy_enabled"
          }
        ],
        "lint": [
          {
            "id": "npm_lint",
            "runtime_id": "npm",
            "argv": ["{runtime}", "run", "lint"],
            "selectors": {"manifests": [], "globs": [], "json_script": "lint", "content_markers": {}},
            "cwd": "manifest_dir",
            "env": {"CI": "1", "NO_COLOR": "1"},
            "timeout_seconds": 600,
            "required_capability": "test_execute",
            "mutates_workspace": false,
            "project_script": true,
            "status": "planned"
          }
        ],
        "typecheck": [
          {
            "id": "npm_typecheck",
            "runtime_id": "npm",
            "argv": ["{runtime}", "run", "typecheck"],
            "selectors": {"manifests": [], "globs": [], "json_script": "typecheck", "content_markers": {}},
            "cwd": "manifest_dir",
            "env": {"CI": "1", "NO_COLOR": "1"},
            "timeout_seconds": 600,
            "required_capability": "test_execute",
            "mutates_workspace": false,
            "project_script": true,
            "status": "planned"
          }
        ]
      },
      "artifacts": ["dist/**", "build/**", "coverage/**", ".next/**"]
    },
    {
      "id": "java_kotlin",
      "label": "Java / Kotlin",
      "status": "planned",
      "categories": ["backend", "jvm", "mobile"],
      "detectors": {
        "manifests": ["pom.xml", "build.gradle", "build.gradle.kts", "settings.gradle", "settings.gradle.kts"],
        "extensions": [".java", ".kt", ".kts"]
      },
      "runtimes": [
        {"id": "java", "candidates": ["java"], "version_args": ["--version"]},
        {"id": "maven", "candidates": ["mvn.cmd", "mvn"], "version_args": ["--version"]},
        {"id": "gradle", "candidates": ["gradle.bat", "gradle"], "version_args": ["--version"]}
      ],
      "action_dependencies": [],
      "commands": {
        "configure": [],
        "build": [
          {
            "id": "maven_package",
            "runtime_id": "maven",
            "argv": ["{runtime}", "-B", "package"],
            "selectors": {"manifests": ["pom.xml"], "globs": [], "json_script": null, "content_markers": {}},
            "cwd": "manifest_dir",
            "env": {"CI": "1", "NO_COLOR": "1"},
            "timeout_seconds": 1200,
            "required_capability": "build_execute",
            "mutates_workspace": true,
            "project_script": false,
            "status": "planned"
          },
          {
            "id": "gradle_build",
            "runtime_id": "gradle",
            "argv": ["{runtime}", "build", "--no-daemon"],
            "selectors": {"manifests": ["build.gradle", "build.gradle.kts"], "globs": [], "json_script": null, "content_markers": {}},
            "cwd": "manifest_dir",
            "env": {"CI": "1", "NO_COLOR": "1"},
            "timeout_seconds": 1200,
            "required_capability": "build_execute",
            "mutates_workspace": true,
            "project_script": false,
            "status": "planned"
          }
        ],
        "test": [
          {
            "id": "maven_test",
            "runtime_id": "maven",
            "argv": ["{runtime}", "-B", "test"],
            "selectors": {"manifests": ["pom.xml"], "globs": [], "json_script": null, "content_markers": {}},
            "cwd": "manifest_dir",
            "env": {"CI": "1", "NO_COLOR": "1"},
            "timeout_seconds": 1200,
            "required_capability": "test_execute",
            "mutates_workspace": false,
            "project_script": false,
            "status": "planned"
          },
          {
            "id": "gradle_test",
            "runtime_id": "gradle",
            "argv": ["{runtime}", "test", "--no-daemon"],
            "selectors": {"manifests": ["build.gradle", "build.gradle.kts"], "globs": [], "json_script": null, "content_markers": {}},
            "cwd": "manifest_dir",
            "env": {"CI": "1", "NO_COLOR": "1"},
            "timeout_seconds": 1200,
            "required_capability": "test_execute",
            "mutates_workspace": false,
            "project_script": false,
            "status": "planned"
          }
        ],
        "lint": [],
        "typecheck": []
      },
      "artifacts": ["target/**", "build/libs/**", "build/reports/**"]
    },
    {
      "id": "go",
      "label": "Go",
      "status": "planned",
      "categories": ["backend", "systems", "cli"],
      "detectors": {"manifests": ["go.mod", "go.work"], "extensions": [".go"]},
      "runtimes": [{"id": "go", "candidates": ["go"], "version_args": ["version"]}],
      "action_dependencies": [],
      "commands": {
        "configure": [],
        "build": [
          {
            "id": "go_build",
            "runtime_id": "go",
            "argv": ["{runtime}", "build", "./..."],
            "selectors": {"manifests": ["go.mod", "go.work"], "globs": [], "json_script": null, "content_markers": {}},
            "cwd": "manifest_dir",
            "env": {"CI": "1"},
            "timeout_seconds": 600,
            "required_capability": "build_execute",
            "mutates_workspace": true,
            "project_script": false,
            "status": "planned"